"udder","Natural lactose producer found on a cow"
"uncertainty","Heisenbergs principal principle"
"undercover","Engaged in the secret gathering of information, or just sleeping in on a Saturday"
"Uzbekistan","In 1220 A.D. the Mongol armies of Genghis Khan overran whats now this Stan"
"unexamined","The Greek philosopher Socrates said that this kind of life is not worth living"
"Narcissus","Upon reflection, this Greek mythological figure fell in love with himself"
"Masters & Johnson","Since 1971 these authors of Human Sexual Response have been viewing it from a married perspective"
"Love is a Many-Splendored Thing","1955 Jennifer Jones-William Holden film whose title song became #1 for the 4 Aces"
"The Art of Loving","Psychoanalyst Erich Fromm defined love as giving in this popular 1956 work"
"charity","28 times in the King James New Testament the greek word agape, meaning love, is trans-lated as this"
"Carrot","Daucus carota"
"Potato","Solanum tuberosum"
"Pepper","Capsicum annuum"
"Corn","Zea mays"
"Lima bean","Phaseolus limensis"
"I Got You Babe","Sonny & Cher:Ich Hab Dich Babe"
"I Think I Love You","The Partridge Family:Ich Denke Ich Liebe Dich"
"Love Will Keep Us Together","The Captain & Tennille:Liebe Halt Uns Zusammen"
"You Are The Sunshine Of My Life","Stevie Wonder:Sie Sind Der Sonnenschein Meines Lebens"
"You Are So Beautiful","Joe Cocker:Sie Sind So Schon"
"Judi Dench", "She won an Oscar for playing Elizabeth I in Shakespeare in Love"
"I Love Lucy","First TV sitcom to hit Number one in the Nielsen ratings"
"Titania","Oberons better half"
"Capulet","Juliets last name"
"Taj Mahal","World famous monument commissioned by a grieving ruler to honour his beloved wife, who had just died."
"Dutch","When a two people on a date pay their own way, they are going..."
"Eros","God of love in greek mythology"
"Cupid","God of love in roman mythology"