"chlorine","In the 1970s it was found that when CFCs break down, this is the main 1 of the 3 elements in them that harms the ozone"
"pseudopods","Amoebas use temporary extensions called these to move or to surround and engulf food"
"hair","Hirsutism is having more than the normal amount of this"
"delta","This 4th letter of the Greek alphabet is used to describ a high-speed aircraft wing type"
"lens","The focal length is the distance from the center of one of these to the focal point"
"interglacial","This term refers to the warm periods within ice ages; we're in one of those periods now"
"elephant","Land animal with the largest teeth"
"light","Diffraction"" refers to the way it bends"
"orchid","Natural vanilla flavoring comes from this tropical flower"
"geology","Stratigraphy is a branch of this science"
"sahara","A dry Sirocco is a warm wind that carries particles of sand from this African desert across the Mediterranean"
"linnaeus","In 1729 this Swede wrote ""Praeludia Sponsaliorum Plantarum"", which described the sexual processes of plants"
"rhodium","This metal's name is from the Greek for ""rose""; it forms salts that give rose-colored solutions"
"roses","Black spot is a serious fungal disease that affects these flowers; rugosas have good resistance"
"dmovies","Polarized lenses are one method used in these items that make some movie theater experiences more exciting"
"evolution","William Jennings Bryan called this theory a ""program of infidelity masquerading under the name of science"
"wind","With cups that rotate horizontally, an anemometer measures the speed of this, anemos in Greek"
"faultlines","Don't blame me--the most common cause of earthquakes is movement along these lines"
"neon","The name of this noble gas is from the Greek for ""new"
"ammonia","The Haber process uses nitrogen and hydrogen to synthetically produce this pungent gas"
"oneatmosphere","This unit of pressure is equal to about 14.7 pounds per square inch or 1 bar"
"neurons","In the nervous system, calcium ions crossing the gap between these cause a release of acetylcholine"
"endoskeleton","As opposed to what arthropods have, vertebrates have this internal framework"
"pasteurization","Mycobacterium tuberculosis is one of the organisms this process kills in milk"
"vitaminc","Like humans, the Red-vented Bulbul bird needs a dietary source of this vitamin, also called ascorbic acid"
"gelatin","Boiling bones and hides converts the protein collagen to this foodstuff"
"fossils","Horseshoe crabs and coelacanth fish are considered living ones of these"
"flavors","Quarks have six known ones of these, which is far short of Baskin-Robbins"
"glaciers","Drumlins are elongated, elliptical hills formed at the edges of these moving ice masses"
"sulphur","This yellow element is found in gunpowder and matches and is used in vulcanizing rubber"
"yogurt","2 bacteria, Lactobacillus Bulgaricus and Streptococcus Thermophilus, turn milk into this"
"helium","This inert gas alters your voice because sound travels more than twice as fast in it as in air"
"yellow","Lignin, a substance in wood, changes when exposed to oxygen; that makes white paper turn this color as it ages"
"afly","Slow-motion video shows this bug evading a swat in 250 milliseconds; for 240 of those, it's repositioning itself to jump"
"dextrose","It's the form of glucose that rotates a plane of polarized light clockwise"
"nucleus","Almost the entire mass of an atom is contained in this central portion"
"mariecurie","In 1914 she became head of the Paris Institute of Radium"
"chromosomes","They're the tiny threadlike structures that carry the genes - you have 23 pairs"
"carbon","Organic chemistry specializes in compounds that contain this element"
"maxplanck","His discovery of energy quanta earned him the 1918 Nobel Prize for Physics"
"water","The only substance known to ancient man in solid, liquid and gas form"
"helium","Most of the world's supply of this light gas comes from natural gas fields in the U.S."
"doglaika","Launched by the Soviets in 1957, the 1st living creature to orbit the Earth was one of these"
"quantumtheory","Science took a leap forward when physicist Max Planck devised this theory about light"
"polaroidcamera","Invented by Edwin Land, it was the first instant camera"
"hydrogen","When Henry Cavendish discovered this lightest-known element, he called it inflammable air"
"compass","In ancient times, lodestone was used as a form of this instrument"
"electron","A positive ion is formed when an atom loses one or more of these"
"oxygen","by definition an anaerobe is an organism that lives in an environment free of this element"
"mantle","The Gutenberg Discontinuity is the boundary that separates the core from this part of the earth"
"silver","From its Latin name argentum, Ag is the chemical symbol for this metallic element"
"lithosphere","It's the solid part of the earth as distinguished from the atmosphere and hydrosphere"
"dna","In 1979 it was discovered that this genetic structure spirals to the left, not to the right as once believed"
"crust","The boundary between the mantle and this layer is called the Mohorovicic Discontinuity"
"fallopiantubes","These 2 ducts lead from the ovaries to the uterus"
"neoprene","In the 1920s, Julius Nieuwland polymerized acetylene, added chlorine atoms and created this synthetic rubber"
"galileo","On July 10, 1996 scientists released close-up photos of Ganymede taken by this space probe"
"comet","In 1993 Eugene and Carolyn Shoemaker and David Levy discovered a highly fragmented one of these"
"light","Silver iodide and silver bromide are sensitive to this, hence their use in photography"
"kernels","Term for the edible endospermic seeds of an ear of corn"
"scurvy","Sore, stiff joints are one symptom of this condition suffered by sailors off the C, vitamin C"
"wernerheisenberg","Though his work was ""uncertain"", he won the Nobel Prize for Physics in 1932, just on ""principle"
"dmitrimendeleev","The element named for him wasn't one of the ones he left a gap for in the periodic table; it came in at 101"
"sun","This heavenly body's prominences include dark filaments and clouds of gas"
"pistils","In botany there are 4 flower parts:  sepals, petals, stamens and these"
"stratosphere","The highest jet streams occur in this layer of the atmosphere that begins 10 miles above the earth"
"messenger","There are 3 types of RNA:  transfer, ribosomal and this"
"ovaries","The Graafian follicles of these glands contain the female reproductive cells"
"jupiter","The sun is 333,000 times as massive as the Earth and 1,047 times as massive as this planet"
"inclinedplane","The screw and the wedge are adaptations of this type of simple machine"
"iron","Of copper, iron or aluminum, the one that would be most attracted to a magnet"
"moon","In a month, this object ranges from about 225,000 miles to 252,000 miles from the Earth"
"meat","By definition, it's what a carnivore eats"
"antarctica","In 1985 a hole was discovered in the ozone layer over this continent"
"yeast","Just using flour and water gives you unleavened bread; add this fungus to leaven it"
"aneroid","Meaning ""without water"", it's one type of barometer"
"uranus","Miranda, a moon of this planet, was the 1st not named after a god or spirit"
"itsposition","Heisenberg's uncertainty principle says you can figure out a particle's momentum or this, not both"
"soundbarrier","In 70-degree air, a plane traveling at about 1,130 feet per second breaks it"
"iceage","Scientists say the Earth has warmed about 9 degrees since the last of these frigid ages"
"hand","It was this part of his wife's body that Wilhelm Roentgen X-rayed first"
"antimatter","In 1995 scientists in Switzerland created atoms of this substance that may not exist naturally in our universe"
"iron","Magnetism occurs most strongly in 3 elements: nickel, cobalt and this"
"cell","In 1665 Robert Hooke described and named this structural unit; bacteria have only one"
"steam","In 1698 Thomas Savery designed the first practical engine to run on this power"
"globulins","This blood protein now comes in alpha, beta and gamma types"
"lever","Simple machine Archimedes would use to ""move the Earth"" if you gave him a firm spot on which to stand"
"barometer","Not long after its development, Robert Boyle renamed the Torricellian Tube this"
"iron","Ferrovanadium is an alloy of vanadium and this metal"
"hooves","The horny casing of the toes of ungulates is called this"
"hubbletelescope","In 1990 this space telescope provided the first picture of Charon as completely separate from Pluto"
"melting","Fusion, the change of a solid to a liquid state, is more commonly called this"
"tungsten","The symbol of this element first isolated in 1783 comes from its German name"
"caffeine","Among alkaloids found in plants, this stimulant is found in coffee or tea"
"intelligencequotient","You may not need a high IQ to know IQ stands for this"
"metamorphosis","Name for the process a caterpillar goes through to become a moth"
"streptococci","When cocci live in pairs, they're called diplococci; in clusters, staphylococci; in chains, this"
"eon","Next in length on the scale of geological time: age, epoch, period, era..."
"magnet","In the early 1830s Michael Faraday found that a moving one of these can produce an electric current"
"dna","In 1953 Watson and Crick built a model of the molecular structure of this, the gene-carrying substance"
"pluto","In 2002 an 800-mile-diameter planetoid called Quaoar was found 1 billion miles past this 1430-mile-diameter planet"
"gobi","In the 1920s scientists discovered fossilized dinosaur eggs in this huge Mongolian desert"
"octanes","Among the compounds called alkanes, the hexanes are C6H14 -- and these hydrocarbons are C8H18"
"spinalcolumn","The fishlike amphioxus has a structure called a notochord which in humans develops into this column"
"plates","In geologic theory, the Earth's outer shell has about 12 big these, moving around tectonically"
"antiseptic","Boric acid, a weak acid, is used as this bacteria-killing infection-preventing type of substance"
"megaton","This unit represents the explosive power of 2 billion pounds of TNT"
"helium","The vast majority of this second-lightest gas comes from natural gas fields in the U.S."
"species","Sialia mexicana is the scientific name of the western bluebird: Sialia is the genus and mexicana tells you this"
"alever","In a first-class type of this, the fulcrum is between the applied force and the load"
"acomet","The tail of this body is formed when ice turns into gas as it gets closer to the sun"
"repel","This 5-letter word is the opposite of attract"
"pencil","The word rubber comes from the discovery that the stuff could be used to rub out marks made with this"
"vitamindeficiency","As it's caused by a lack of niacin, pellagra is termed this type of deficiency disease"
"tides","In parts of the Caribbean, these are on a diurnal cycle: one high, one low a day, that's it"
"anelectrolyte","It's a substance that conducts current; sodium and potassium are 2 of the ones Gatorade restores to your body"
"periodictable","Dimitri Mendeleyev made modern chemistry possible when he set this grouping of the elements"
"pendulum","A simple one of these consists of a small weight swinging to and fro on the end of a string"
"vaporization","The process by which a substance changes from liquid to a gas is called this"
"marspluto","The planets that are smaller than Earth are Mercury, Venus and these two"
"josephpriestley","When this scientist discovered oxygen, he called it dephlogisticated air"
"acell","Most living organisms have millions, but a prisoner only has one"
"atoms","A 5th C. B.C. Greek philosopher was 1st to theorize that all matter is made of these"
"ascavenger","Term for creatures like vultures or hermit crabs that eat carcasses and refuse"
"equator","Days and nights are always 12 hours long there"
"measurement","If you're studying mensuration, you're studying this"
"light","It's what the ""L"" stands for in ""laser"
"centigrade","The Celsius temperature scale is also called this, meaning ""divided into one hundred parts"
"apulley","This one of the simple machines is made by using a wheel and a rope"
"homeostasis","Shock researcher Walter Cannon coined this word for an organism's ability to maintain internal equilibrium"
"einstein","He was in Shanghai in 1921 when he found out he had won a Nobel Prize for Physics"
"gravity","Isaac Newton published his first mathematical formulation for this fundamental force in 1687"
"amuscle","In 1996 (seems late) researchers announced a new one of these body parts, the spheno-mandibularis"
"smallpox","During an epidemic of this disease in 1796, Edward Jenner discovered the power of vaccines and used it to save lives"
"latentenergy","When boiling water, energy absorbed that escapes as vapor is this type of heat, from Latin latere, ""to hide"
"galileo","In 1633 Descartes suppressed his book ""The World"" because it supported the ideas of this Italian"
"oxidation","Rust is a slow example of this process:  combustion is defined as a ""rapid"" one"
"nitroglycerin","Don't worry about exploding when using this heart medicine -- it's too diluted"
"willow","This family of trees has 2 genera, populus and salix; we wonder to which one Alyson Hannigan belongs"
"ectoplasm","Some protozoans' bodies can be divided into the fluid inner endoplasm and this more rigid outer part"
"computerviruses","In computerese, a ""vaccine"" is a program that seeks out and destroys these"
"algae","Varieties of these simple plants include red, brown, green and blue-green"
"ivanpavlov","Behaviorists and dogs drool over the work of this Russian physiologist"
"aluminum","The most abundant metal on Earth, when it was discovered in 1820 it was worth more than gold"
"bigbang","The universe's background radiation is thought to be left over from this primordial event"
"conductance","Electrically speaking, it's the opposite of resistivity"
"bone","Ossification, the formation of this, begins in the embryo at the end of the second month"
"ethyl","C<sub>2</sub>H<sub>5</sub>, it's found before ""alcohol"" and is a homophone of a female first name"
"atria","These 2 upper chambers of the heart receive and collect blood from the veins"
"radiation","It's measured in rads"
"apterodactyl","In 1975 in Texas scientists found fossils of this flying lizard with a more than 50' wingspan"
"sirius","The name of this dog star, the brightest star in the night sky, is Greek for ""scorching"
"chlorophyll","This green pigment is required for photosynthesis"
"inches","One meter equals 39.37 of these"
"asugar","Fructose is a monosaccharide, a simple one of these"
"hydrogen","pH, the measure of acidity, stands for ""potential of"" this most abundant element"
"man","The mammal that holds the record for the longest lifespan"
"gravity","You have ""receptors"" in your ears for this fundamental force, and they get upset when  you're weightless"
"naturalselection","Darwin defined it as ""preservation of favorable variations and the rejection of injurious variations"
"lithosphere","Below the atmosphere is this ""sphere"", from the Greek for ""stone"
"horsemare","The mother of a mule"
"tailbone","It's another name for your coccyx"
"antifreeze","Union Carbide makes this common car additive that contains ethylene glycol"
"millibar","This unit of measure in weather is abbreviated mb"
"pierrecurie","Frenchman who discovered the Piezoelectric Effect, that certain crystals when stressed make electricity"
"brain","An EEG records the electrical activity of this organ"
"chromosomes","Human beings normally have 46 of these in most of their cells"
"potassium","This second-lightest metal, symbol K, is so soft it can be cut with a knife"
"robertgoddard","He's been called the ""Father of Modern Rocketry"
"georgohm","According to his law, resistance in a DC circuit is the ratio of volts to amps"
"hydrogen","It's the element whose atomic weight is closest to its atomic number"
"batteries","Inventors of these include Georges Leclanche, Gaston Plante and Alessandro Volta"
"sea","Life here was the subject of the 1965 book ""World Without Sun"
"sputnik","After 1,400 orbits it fell back to Earth January 4, 1958 and burned up"
"spraycans","In 1977 the U.S. banned these that used freon as the propellant"
